{
  "command": "status",
  "contract_version": "leos.cli-result.v1",
  "exit_code": 0,
  "generated_at": "2026-07-20T00:00:00+00:00",
  "ok": true,
  "payload": {
    "checks": [
      {
        "check_id": "installation-installed",
        "ok": true
      },
      {
        "check_id": "first-run-ready",
        "ok": true
      },
      {
        "check_id": "required-services-healthy",
        "ok": true
      },
      {
        "check_id": "manifest-drift-zero",
        "ok": true
      },
      {
        "check_id": "plaintext-secrets-absent",
        "ok": true
      }
    ],
    "contract_version": "leos.system-status.v1",
    "first_run": {
      "ok": true,
      "session_id": "first-run-7a0168a004401f40",
      "status": "ready"
    },
    "generated_at": "2026-07-20T00:00:00+00:00",
    "installation": {
      "drift": [],
      "installation_id": "installation-3bafc36b83beaf6f",
      "ok": true,
      "profile": "leos-standard-nvidia"
    },
    "resources": {
      "cpu_cores": 32,
      "memory_available_mb": 98304,
      "nvidia_gpu_count": 2,
      "storage_free_gb": 500
    },
    "services": {
      "healthy": 5,
      "required_unhealthy": 0,
      "total": 6,
      "unhealthy": 0,
      "unknown": 1
    },
    "source_release": "0.1.0-dev-preview-rc11",
    "status": "ready",
    "target_root": "leos-example"
  },
  "payload_contract": "leos.system-status.v1",
  "safety": {
    "container_daemon_contacted": false,
    "external_network_contacted": false,
    "plaintext_secret_exposed": false,
    "production_network_attached": false,
    "production_state_accessed": false,
    "read_only": true
  }
}
